{
  "schema": "govuk-webmcp.okf-federation-lock.v1",
  "profile": "govuk-webmcp.okf-federated-search.v1",
  "evidenceTier": "federated-source-snapshot",
  "authoredAt": "2026-08-30T00:00:00Z",
  "aggregate": {
    "sourceCount": 4,
    "recordCount": 58655,
    "artifactCount": 73,
    "decodedArtifactBytes": 420445217,
    "storedArtifactBytes": 13021675,
    "sourceIdentityDigest": "39b0228d143a0d14cc81d1ff3e949e51fe1e75015cc211e2fe02b887d184a875",
    "aggregateDigest": "c269c8d212bc04d9bce6900c35fd09ad00ce4d5f88a44cf0508da1c3f94478ad"
  },
  "sources": [
    {
      "id": "uk-living",
      "title": "A Life in the UK — life-course discovery corpus",
      "repositoryUrl": "https://github.com/chris-page-gov/okf-uk-living",
      "baseUrl": "https://chris-page-gov.github.io/okf-uk-living/",
      "deploymentId": "5943077379",
      "revision": "4bc010eab3c9c072f68960393c1458a772aa700b",
      "revisionReproducibility": "exact-repository-revision",
      "snapshot": "life-course-authority-infrastructure-2026-08-08",
      "descriptor": {
        "path": "okf-explorer.json",
        "bytes": 3378,
        "sha256": "ff69f0162a4ba93156b150ae4eea0070c8c8a81187ed5cc7d2425f37b8db34dc"
      },
      "dataManifest": {
        "path": "large/data/manifest.json",
        "bytes": 1590,
        "sha256": "fe0e11219ceec88702ca8a5d536d6d0ac0425f3bb29c7586884cfb0e56c957b4"
      },
      "searchManifest": {
        "path": "large/data/search/manifest.json",
        "bytes": 13344,
        "sha256": "112608e17bca06d6b92313dbcdcff1f1798a2bfdc2cb11724a3d26b88d3d5e26",
        "schema": "okf-static-search.v1"
      },
      "population": {
        "records": 9757,
        "unit": "search documents",
        "serviceFamilies": 293,
        "resources": 879
      },
      "recordArtifacts": [
        {
          "role": "records",
          "sourcePath": "large/data/records-0.json",
          "storedPath": "app/data/sources/okf-federation/uk-living/records-000.json.gz",
          "sourceBytes": 1857390,
          "sourceSha256": "77205e5aadd9fb1d6295b5cbc27f09d4b1d8d21c967f96f7e7e46fe3cde265d9",
          "storedBytes": 45736,
          "storedSha256": "ce148572005cfd77429507ac2482a35aedca47973027e125857fe421245e4063",
          "compression": "gzip",
          "itemCount": 1000
        },
        {
          "role": "records",
          "sourcePath": "large/data/records-1.json",
          "storedPath": "app/data/sources/okf-federation/uk-living/records-001.json.gz",
          "sourceBytes": 2023885,
          "sourceSha256": "8c90d19163ba759686a2c4735ccea2de3dd1019460fb0c3c0f0c2d0a3717d525",
          "storedBytes": 43058,
          "storedSha256": "fb0ef90569ccd92e7496980050fef3fca4dde2808558fe8a2f10871a835e145d",
          "compression": "gzip",
          "itemCount": 1000
        },
        {
          "role": "records",
          "sourcePath": "large/data/records-2.json",
          "storedPath": "app/data/sources/okf-federation/uk-living/records-002.json.gz",
          "sourceBytes": 2144286,
          "sourceSha256": "f3f4ce2c2028c04fad8416254158987ad3a5a07b98d27d8005e460f4a711674b",
          "storedBytes": 66172,
          "storedSha256": "478b77b135d23a42c602dece1ac6a62aad3d4f34e467c3ed7ac7e7f6c96da329",
          "compression": "gzip",
          "itemCount": 1000
        },
        {
          "role": "records",
          "sourcePath": "large/data/records-3.json",
          "storedPath": "app/data/sources/okf-federation/uk-living/records-003.json.gz",
          "sourceBytes": 2070933,
          "sourceSha256": "2743918b0e5a7636624cd61a94c6ca44af7426472f1261680c7cdfc63030e780",
          "storedBytes": 38902,
          "storedSha256": "7ec99cbe199bb3e27185af2c66a37976d38670fcf581fc8b682f840234ddec21",
          "compression": "gzip",
          "itemCount": 1000
        },
        {
          "role": "records",
          "sourcePath": "large/data/records-4.json",
          "storedPath": "app/data/sources/okf-federation/uk-living/records-004.json.gz",
          "sourceBytes": 2161521,
          "sourceSha256": "c3a124876f718b0f8bc8d75fe8705469af3373acc0d3706599e46918fdd6f4d4",
          "storedBytes": 39671,
          "storedSha256": "adb6d42be309907fa81929a4ff62c06938e6161bec01076847ba37ce49927dec",
          "compression": "gzip",
          "itemCount": 1000
        },
        {
          "role": "records",
          "sourcePath": "large/data/records-5.json",
          "storedPath": "app/data/sources/okf-federation/uk-living/records-005.json.gz",
          "sourceBytes": 2114424,
          "sourceSha256": "05d9d7247168d7e987ce0ec65e3b5acf231296be8041371e03a6507eca388bda",
          "storedBytes": 40104,
          "storedSha256": "90ad2143f6391988be860de982ec0b9c0d7fb725265c50d0424158e4cdb860b6",
          "compression": "gzip",
          "itemCount": 1000
        },
        {
          "role": "records",
          "sourcePath": "large/data/records-6.json",
          "storedPath": "app/data/sources/okf-federation/uk-living/records-006.json.gz",
          "sourceBytes": 2348534,
          "sourceSha256": "8cb4dba51dbf45b51a0dd8a513fb0a3363b9381f5ed3020314b99f3c964556e8",
          "storedBytes": 94083,
          "storedSha256": "15cbd9e736856828ea4cfbd7dee897de4dffc421724e31c0dff53d73fc2f5583",
          "compression": "gzip",
          "itemCount": 1000
        },
        {
          "role": "records",
          "sourcePath": "large/data/records-7.json",
          "storedPath": "app/data/sources/okf-federation/uk-living/records-007.json.gz",
          "sourceBytes": 3646908,
          "sourceSha256": "0c65a2c6909d218db62e1992c0905d1b0c039a6878bfca65083a5d961b9cee2e",
          "storedBytes": 167473,
          "storedSha256": "563ccd60c7e14e9e5b604a538b4662599c933edf1b2980c24c85502192691a0f",
          "compression": "gzip",
          "itemCount": 1000
        },
        {
          "role": "records",
          "sourcePath": "large/data/records-8.json",
          "storedPath": "app/data/sources/okf-federation/uk-living/records-008.json.gz",
          "sourceBytes": 1742500,
          "sourceSha256": "ab797ddb9891c1949c9c3b443d7439ebcd6d410239db0886b2bb425c9e7cd27d",
          "storedBytes": 39387,
          "storedSha256": "3273fe523506b07e06c5c375094eeb96126a03264b3ed19a9eb870b40c8af123",
          "compression": "gzip",
          "itemCount": 1000
        },
        {
          "role": "records",
          "sourcePath": "large/data/records-9.json",
          "storedPath": "app/data/sources/okf-federation/uk-living/records-009.json.gz",
          "sourceBytes": 1327074,
          "sourceSha256": "a68da5d93406a2ec70d3244038c8d8bce88f2f5e5cb47f217618a06fec75c54c",
          "storedBytes": 51091,
          "storedSha256": "0acad1296d41ea6d8abb248dcf92fcbff01eba0c036169e75cdf551b482b957d",
          "compression": "gzip",
          "itemCount": 757
        }
      ],
      "supportingArtifacts": [
        {
          "role": "resources",
          "sourcePath": "large/data/resources-0.json",
          "storedPath": "app/data/sources/okf-federation/uk-living/resources-000.json.gz",
          "sourceBytes": 1297204,
          "sourceSha256": "848c6d3a9d002b680381b77d5161ba7aedbab0d979dd5cffbb376a948686b01b",
          "storedBytes": 67193,
          "storedSha256": "dbdb4edd6f2476cb7781477c701e95661e784211d9be0ee91fb357af7f182bb0",
          "compression": "gzip",
          "itemCount": 879
        }
      ],
      "requestPolicy": {
        "credentials": "omit",
        "redirect": "error",
        "sameOriginOnly": true
      },
      "budgets": {
        "maximumResourceBytes": 16777216,
        "maximumDecodedBytes": 22734659,
        "maximumStoredBytes": 692870,
        "maximumArtifacts": 11
      },
      "rights": {
        "status": "source-specific",
        "statement": "Repository-authored structures and summaries use the producer notice; upstream content remains link-only."
      },
      "access": {
        "status": "public-static-metadata",
        "statement": "Discovery routes only; jurisdiction, eligibility and provider decisions remain with the linked current authority."
      },
      "limitations": [
        "The snapshot contains 9,757 records and governed concepts, including 293 service families; those counts are not interchangeable.",
        "Only 2 of 293 service families had named specialist acceptance at publication time.",
        "The source links and original summaries do not decide eligibility or provide legal, clinical, safeguarding or financial advice."
      ],
      "boundaries": {
        "officialApiCalls": false,
        "personalContextAccepted": false,
        "sourceDerivedContentIsUntrusted": true
      },
      "entryDigest": "efd71bfc2d8eea499bb2242e8cd1262f99fe140d81b06e4fbe5b86196c58f845"
    },
    {
      "id": "ons",
      "title": "ONS data discovery OKF",
      "repositoryUrl": "https://github.com/chris-page-gov/okf-ons",
      "baseUrl": "https://chris-page-gov.github.io/okf-ons/",
      "deploymentId": "5969704658",
      "revision": "b0283b0d0dd2bbd06a8311dd5d1342eea0c36fdf",
      "revisionReproducibility": "deployed-bytes-observed-separately",
      "snapshot": "monday-2026-07-17-r2",
      "descriptor": {
        "path": "okf-explorer.json",
        "bytes": 6208,
        "sha256": "a317360e11996059da9957d89d25e7b9cf5c9b94f31184e36baeee74a4af2719"
      },
      "dataManifest": {
        "path": "data/manifest.json",
        "bytes": 3644,
        "sha256": "464aab1ad75fdf518ba31c394ecd78521b2e839602e6eaa97184bab89729ff09"
      },
      "searchManifest": {
        "path": "data/search/manifest.json",
        "bytes": 78812,
        "sha256": "371de3b41a8c294313263de0d1795e98494ce061a053b9df99aac10efb97f53c",
        "schema": "okf-static-search.v2"
      },
      "population": {
        "records": 5097,
        "unit": "search documents"
      },
      "recordArtifacts": [
        {
          "role": "records",
          "sourcePath": "data/datasets-0.json",